{
  "name": "development",
  "description": "Keeps Critical/High isolation findings; relaxes selected development conveniences.",
  "version": "1.0.0",
  "fail_on": "High",
  "minimum_score": 0,
  "allow_critical_suppressions": false,
  "require_digest_pinning": false,
  "require_non_root": true,
  "require_read_only": false,
  "require_cap_drop_all": false,
  "require_no_new_privileges": true,
  "require_resource_limits": false,
  "require_pid_limit": false,
  "require_healthcheck": false,
  "require_bounded_logging": false,
  "disallow_wildcard_ports": false,
  "disallow_host_namespaces": true,
  "disallow_external_file_refs": true,
  "disabled_rules": [],
  "severity_overrides": {
    "CSB-CMP-007": "High",
    "CSB-CMP-024": "High",
    "CSB-CMP-030": "Low",
    "CSB-CMP-040": "Informational",
    "CSB-CMP-080": "Informational",
    "CSB-CMP-081": "Informational",
    "CSB-CMP-082": "Informational",
    "CSB-CMP-085": "Informational",
    "CSB-CMP-112": "Informational",
    "CSB-DF-003": "Informational",
    "CSB-DF-010": "Low",
    "CSB-DF-064": "Informational"
  },
  "stateful_services": [],
  "service_secret_expectations": {},
  "backend_networks": [],
  "scoring_deductions": {
    "Critical": 25,
    "High": 15,
    "Medium": 7,
    "Low": 2,
    "Informational": 0
  }
}
